{
  "schema_version": 1,
  "coverage": "shot_excerpt",
  "source_video": "project-output/example/downloads/video-20261012T013249Z-dc518e8c-0cfb09/source.mp4",
  "video_stream_index": 1,
  "source_fps": 30,
  "shot_id": "zoo-opening",
  "continuous_take_id": "zoo-take-01",
  "shot_bounds_pts_s": [
    0,
    4.9
  ],
  "observed_bounds_pts_s": [
    1,
    1.9
  ],
  "assets": [
    {
      "id": "B12",
      "name": "动物园雄狮",
      "role": "subject",
      "reference_asset_id": "B12",
      "reference_status": "generated"
    },
    {
      "id": "B14",
      "name": "动物园四翼飞虫",
      "role": "subject",
      "reference_asset_id": "B14",
      "reference_status": "generated",
      "note": "高速模糊限制细部可辨度；资产用于形态，不决定入画侧或飞行速度。"
    },
    {
      "id": "zoo-rock-net",
      "name": "岩台和近前景链网",
      "role": "scene",
      "reference_asset_id": "M01",
      "reference_status": "generated"
    },
    {
      "id": "visitor-phone",
      "name": "近前景游客竖举手机",
      "role": "prop",
      "reference_asset_id": null,
      "reference_status": "scene_reuse",
      "note": "真实可见但无独立道具图；按源帧保留，不从本记录自动生成。"
    }
  ],
  "events": [
    {
      "order": 1,
      "bounds_pts_s": [
        1,
        1.166667
      ],
      "actor_ids": [
        "B12"
      ],
      "target_ids": [
        "zoo-rock-net"
      ],
      "action": "雄狮伏在最高岩台，前爪撑住岩面，抬头张口；身体尚未离岩。",
      "entry_side": "already_in_frame",
      "exit_side": "none",
      "motion_direction": "停留岩台上",
      "speed_rhythm": "作为快速掠抓之前的状态，不扩写额外等待。",
      "contact": {
        "status": "not_applicable",
        "first_verified_pts_s": null,
        "bounds_pts_s": null,
        "evidence": []
      },
      "evidence": [
        {
          "path": "project-output/example/shensi/zoo-motion-30fps/frames/motion-00031.jpg",
          "pts_s": 1.0
        },
        {
          "path": "project-output/example/shensi/zoo-motion-30fps/frames/motion-00035.jpg",
          "pts_s": 1.133333
        }
      ]
    },
    {
      "order": 2,
      "bounds_pts_s": [
        1.166667,
        1.433333
      ],
      "actor_ids": [
        "B14"
      ],
      "target_ids": [
        "B12"
      ],
      "action": "暗色飞虫从画面右侧高速横掠，上方身体横向扫过；抓足在掠过中攫住雄狮。",
      "entry_side": "right",
      "exit_side": "none",
      "motion_direction": "由右向左横掠，身体轴近水平；不是从顶端垂直降下。",
      "speed_rhythm": "1.166667秒右上首次入画，1.333—1.400秒抓足在狮身处重叠；横掠不停，1.433333秒狮身被扯起。",
      "contact": {
        "status": "bracketed",
        "first_verified_pts_s": 1.433333,
        "bounds_pts_s": [
          1.3,
          1.433333
        ],
        "evidence": [
          {
            "path": "project-output/example/shensi/zoo-motion-30fps/frames/motion-00040.jpg",
            "pts_s": 1.3
          },
          {
            "path": "project-output/example/shensi/zoo-motion-30fps/frames/motion-00041.jpg",
            "pts_s": 1.333333
          },
          {
            "path": "project-output/example/shensi/zoo-motion-30fps/frames/motion-00043.jpg",
            "pts_s": 1.4
          },
          {
            "path": "project-output/example/shensi/zoo-motion-30fps/frames/motion-00044.jpg",
            "pts_s": 1.433333
          }
        ],
        "note": "原30fps已复核。抓足接触区域在1.333—1.400秒可见，1.433333秒拉起狮身证实抓住；精确闭爪细部受遮挡与模糊限制，不宣称单一精确首次接触帧。"
      },
      "evidence": [
        {
          "path": "project-output/example/shensi/zoo-motion-30fps/frames/motion-00036.jpg",
          "pts_s": 1.166667
        },
        {
          "path": "project-output/example/shensi/zoo-motion-30fps/frames/motion-00040.jpg",
          "pts_s": 1.3
        },
        {
          "path": "project-output/example/shensi/zoo-motion-30fps/frames/motion-00041.jpg",
          "pts_s": 1.333333
        },
        {
          "path": "project-output/example/shensi/zoo-motion-30fps/frames/motion-00043.jpg",
          "pts_s": 1.4
        },
        {
          "path": "project-output/example/shensi/zoo-motion-30fps/frames/motion-00044.jpg",
          "pts_s": 1.433333
        }
      ]
    },
    {
      "order": 3,
      "bounds_pts_s": [
        1.433333,
        1.9
      ],
      "actor_ids": [
        "B14",
        "B12"
      ],
      "target_ids": [],
      "action": "1.433333秒狮身被扯起，1.466667秒四脚离岩，1.50—1.733秒随飞虫向左上带离近处构图；岩台位置空出。",
      "entry_side": "already_in_frame",
      "exit_side": "upper_left",
      "motion_direction": "抓起后连续向左上离开当前画面区域",
      "speed_rhythm": "接触区域到离岩约0.10—0.13秒，横掠、抓取、带离连续完成，不新增停顿。",
      "contact": {
        "status": "not_applicable",
        "first_verified_pts_s": null,
        "bounds_pts_s": null,
        "evidence": []
      },
      "evidence": [
        {
          "path": "project-output/example/shensi/zoo-motion-30fps/frames/motion-00044.jpg",
          "pts_s": 1.433333
        },
        {
          "path": "project-output/example/shensi/zoo-motion-30fps/frames/motion-00045.jpg",
          "pts_s": 1.466667
        },
        {
          "path": "project-output/example/shensi/zoo-motion-30fps/frames/motion-00049.jpg",
          "pts_s": 1.6
        },
        {
          "path": "project-output/example/shensi/zoo-motion-30fps/frames/motion-00053.jpg",
          "pts_s": 1.733333
        },
        {
          "path": "project-output/example/shensi/zoo-motion-30fps/frames/motion-00058.jpg",
          "pts_s": 1.9
        }
      ]
    }
  ],
  "camera_phases": [
    {
      "bounds_pts_s": [
        1,
        1.4
      ],
      "location": "游客一侧、链网外，游客头与竖举手机在近前景",
      "movement": "基本维持对岩台的朝向",
      "shake": [
        {
          "kind": "natural_handheld",
          "bounds_pts_s": [
            1,
            1.4
          ],
          "observed_basis": "网格、岩台和前景手机间轻微不规则位移"
        }
      ],
      "evidence": [
        {
          "path": "project-output/example/shensi/motion-review-opening/run-20261012T065247814755Z/frames/motion-00011.jpg",
          "pts_s": 1
        },
        {
          "path": "project-output/example/shensi/motion-review-opening/run-20261012T065247814755Z/frames/motion-00014.jpg",
          "pts_s": 1.3
        },
        {
          "path": "project-output/example/shensi/motion-review-opening/run-20261012T065247814755Z/frames/motion-00015.jpg",
          "pts_s": 1.4
        }
      ]
    },
    {
      "bounds_pts_s": [
        1.4,
        1.9
      ],
      "location": "同一游客机位、链网外",
      "movement": "突发掠抓后摄影机慌乱晃动，岩台与树线偏移并拖出模糊；后续急抬天空需在完整镜头中另记",
      "shake": [
        {
          "kind": "operator_reaction",
          "bounds_pts_s": [
            1.4,
            1.9
          ],
          "observed_basis": "1.6及1.9秒岩台、树线和近前景一起倾斜偏移，不是只给飞虫叠加运动模糊"
        }
      ],
      "evidence": [
        {
          "path": "project-output/example/shensi/motion-review-opening/run-20261012T065247814755Z/frames/motion-00015.jpg",
          "pts_s": 1.4
        },
        {
          "path": "project-output/example/shensi/motion-review-opening/run-20261012T065247814755Z/frames/motion-00017.jpg",
          "pts_s": 1.6
        },
        {
          "path": "project-output/example/shensi/motion-review-opening/run-20261012T065247814755Z/frames/motion-00020.jpg",
          "pts_s": 1.9
        }
      ]
    }
  ],
  "texture_evidence": [
    {
      "description": "低角度暖日光，雄狮褐金毛发、苔斑灰岩、近处链网；动态模糊不用于猜造飞虫细部。",
      "evidence": [
        {
          "path": "project-output/example/shensi/motion-review-opening/run-20261012T065247814755Z/frames/motion-00011.jpg",
          "pts_s": 1
        },
        {
          "path": "project-output/example/shensi/motion-review-opening/run-20261012T065247814755Z/frames/motion-00015.jpg",
          "pts_s": 1.4
        }
      ]
    }
  ],
  "uncertainties": [
    {
      "scope": "抓足闭合细部",
      "description": "原30fps可以确定右入横掠、拉起与离岩先后；爪足与鬃毛重叠以及高速模糊仍遮挡具体闭爪点。",
      "next_action": "提示词保留已证实的瞬间抓取和带离，不补造爪指动作，不改变方向或拖慢速度。",
      "ask_user": false
    }
  ],
  "independent_review": {
    "status": "passed",
    "differences": [
      "原稿上方入场已改为右侧横掠",
      "原稿慢提暗示已改为瞬间抓取连续带离",
      "初始雄狮立姿已改为伏身前爪撑岩面"
    ],
    "notes": "原30fps序列独立回看后与修订稿比对；本片首段操作栏已实际确认18秒、16:9和14参考，抓取与反应时间分开。此局部示例不代表全片无遗漏。"
  },
  "generated_review": {
    "status": "not_generated",
    "differences": [],
    "notes": "没有生成成片；生成后继续按同一事件链逐镜复核。"
  }
}
